post_id,comment_id,author,created_utc,body,score
10849q8,j3rtus1,TonyManfredonia,1673371279.0,"Currently seeking someone to do a dynamic, Adobe After Effects-style lyric video. My previous animator is unavailable due to some last minute changes.

Song is due in March, so video is needed in roughly 6 weeks.

Paid gig! If you or someone you know are interested, please give me the word. Thank you! 🎶",1
10849q8,j4m5pta,Pixxilutia,1673893219.0,"Hello, I am looking for rappers / singers who need a song mixed and mastered, willing to work for free.  
  
My latest work : https://drive.google.com/file/d/11Ty9mdHajJtyVo6TnAtpZPSZQeiaIcuQ/view?usp=sharing",1
10849q8,j62ydfm,Schuh_Mischlingshund,1674812880.0,"Hey, What kind of video do you have in mind? Can you send me a reference?

Best, 

Schuh",1
