post_id,title,author,created_utc,url,num_comments,score
12bq2zn,If you could ask ANY artist for help with your music...,SeriouslyPoor98,1680629255.0,https://www.reddit.com/r/WeAreTheMusicMakers/comments/12bq2zn/if_you_could_ask_any_artist_for_help_with_your/,340,202
wvr305,What was the one thing that really improved your music making?,EdinKaso,1661266880.0,https://www.reddit.com/r/WeAreTheMusicMakers/comments/wvr305/what_was_the_one_thing_that_really_improved_your/,263,275
yxspy0,What are some good songs that have the same chord progression the whole song?,miguelmakesmusic,1668697824.0,https://www.reddit.com/r/WeAreTheMusicMakers/comments/yxspy0/what_are_some_good_songs_that_have_the_same_chord/,250,154
zcwlca,Help with a DAW for my wife,IAmBrahmus,1670213807.0,https://www.reddit.com/r/WeAreTheMusicMakers/comments/zcwlca/help_with_a_daw_for_my_wife/,247,170
11i3zu9,Very accomplished music manager told me that aspiring artists should not release to DSPs. Please help me make some sense of this.,hurryupandbuyplease,1677946788.0,https://www.reddit.com/r/WeAreTheMusicMakers/comments/11i3zu9/very_accomplished_music_manager_told_me_that/,218,170
xc5pki,Do you think there is a “best place in the world” to establish a music career?,Mafs1998,1662965436.0,https://www.reddit.com/r/WeAreTheMusicMakers/comments/xc5pki/do_you_think_there_is_a_best_place_in_the_world/,207,115
10e0fua,What's the next form of technology you think will shoot music into a new era?,caachr77,1673922968.0,https://www.reddit.com/r/WeAreTheMusicMakers/comments/10e0fua/whats_the_next_form_of_technology_you_think_will/,207,65
zttay2,What should i learn to be a good ear for my bf who is a music producer?,gotmesogood,1671831366.0,https://www.reddit.com/r/WeAreTheMusicMakers/comments/zttay2/what_should_i_learn_to_be_a_good_ear_for_my_bf/,205,329
v58edl,Can i learn piano with only one hand?,joyleader,1654414441.0,https://www.reddit.com/r/WeAreTheMusicMakers/comments/v58edl/can_i_learn_piano_with_only_one_hand/,201,249
10tpwv1,How to play guitar like the piano?,CollectsLlamas,1675541333.0,https://www.reddit.com/r/WeAreTheMusicMakers/comments/10tpwv1/how_to_play_guitar_like_the_piano/,192,225
125uog1,How would you spend 5k to grow your fanbase?,thro3829292020399,1680111102.0,https://www.reddit.com/r/WeAreTheMusicMakers/comments/125uog1/how_would_you_spend_5k_to_grow_your_fanbase/,186,176
u8xzaf,Enough already!,TheResinAnts,1650576229.0,https://www.reddit.com/r/WeAreTheMusicMakers/comments/u8xzaf/enough_already/,178,613
v7wi08,"The Truth about Spotify, LUFS and Mastering Targets (Includes LUFS measurements)",nunyabiz2020,1654713139.0,https://www.reddit.com/r/WeAreTheMusicMakers/comments/v7wi08/the_truth_about_spotify_lufs_and_mastering/,177,181
ytdm5m,[Complete beginner] I can't come up with a single musical idea. What can i do to learn?,Yertz0,1668274919.0,https://www.reddit.com/r/WeAreTheMusicMakers/comments/ytdm5m/complete_beginner_i_cant_come_up_with_a_single/,174,142
w8hjxs,Any way to help my son develop his skills?,Nathaniel66,1658835649.0,https://www.reddit.com/r/WeAreTheMusicMakers/comments/w8hjxs/any_way_to_help_my_son_develop_his_skills/,173,319
v25c7z,How to tell if Mastering was done well.,gh0stmartini,1654046656.0,https://www.reddit.com/r/WeAreTheMusicMakers/comments/v25c7z/how_to_tell_if_mastering_was_done_well/,173,208
zi0xyi,"As a music producer, do you take offense when an artist tells you that what you created isn’t what they envisioned?",Zoma456,1670700120.0,https://www.reddit.com/r/WeAreTheMusicMakers/comments/zi0xyi/as_a_music_producer_do_you_take_offense_when_an/,166,216
10vsl94,"Why are there so many co-writers on modern, mainstream pop songs/albums? Are there any mainstream ""auteur""-style artists that write and produce their music solo?",zzxxzzxxzzxxzzxxzzxx,1675744282.0,https://www.reddit.com/r/WeAreTheMusicMakers/comments/10vsl94/why_are_there_so_many_cowriters_on_modern/,166,232
unzcnx,Weed : Beneficial when it comes to making music?,OnyxiasLair,1652356594.0,https://www.reddit.com/r/WeAreTheMusicMakers/comments/unzcnx/weed_beneficial_when_it_comes_to_making_music/,164,117
xywrhk,"I got 10,000 monthly listeners in under 3 months with no label, team, or money. Here’s what I learned.",EdinKaso,1665245941.0,https://www.reddit.com/r/WeAreTheMusicMakers/comments/xywrhk/i_got_10000_monthly_listeners_in_under_3_months/,160,697
vn7dkz,What instrument can my buddy play without the use of his fingers?,Normal_Palpitation,1656478407.0,https://www.reddit.com/r/WeAreTheMusicMakers/comments/vn7dkz/what_instrument_can_my_buddy_play_without_the_use/,154,159
11cjre0,"HELP: Drummer backed out 3 weeks before our first gig, unsure how to proceed",PrincessConsuela_,1677424901.0,https://www.reddit.com/r/WeAreTheMusicMakers/comments/11cjre0/help_drummer_backed_out_3_weeks_before_our_first/,150,166
