post_id,title,author,created_utc,url,num_comments,score
12bq2zn,If you could ask ANY artist for help with your music...,SeriouslyPoor98,1680629255.0,https://www.reddit.com/r/WeAreTheMusicMakers/comments/12bq2zn/if_you_could_ask_any_artist_for_help_with_your/,340,200
121s4xw,"Artists who have had success through underground music scenes, what do you feel are some things that helped you along more than others?",MetroidAddict64,1679763981.0,https://www.reddit.com/r/WeAreTheMusicMakers/comments/121s4xw/artists_who_have_had_success_through_underground/,131,241
11vy09p,Help us come up with fun constraints for songwriting,stylinoboe,1679260581.0,https://www.reddit.com/r/WeAreTheMusicMakers/comments/11vy09p/help_us_come_up_with_fun_constraints_for/,108,44
124jer2,Help an aspiring producer!,Successful_Future_85,1679996556.0,https://www.reddit.com/r/WeAreTheMusicMakers/comments/124jer2/help_an_aspiring_producer/,40,78
11tq845,Please help me understand what to do next if I want to do live shows with songs I wrote in Logic Pro,Ominous_Treachery,1679057485.0,https://www.reddit.com/r/WeAreTheMusicMakers/comments/11tq845/please_help_me_understand_what_to_do_next_if_i/,28,30
11rino6,"Need help creating a physical sequencer, using a webcam, grid and physical objects.",Uzorglemon,1678845603.0,https://www.reddit.com/r/WeAreTheMusicMakers/comments/11rino6/need_help_creating_a_physical_sequencer_using_a/,13,38
125nii3,Need Help With Recording,nahtaNoh6,1680095025.0,https://www.reddit.com/r/WeAreTheMusicMakers/comments/125nii3/need_help_with_recording/,15,1
1238il6,Will a New Interface Help?,meJohnnyD,1679884477.0,https://www.reddit.com/r/WeAreTheMusicMakers/comments/1238il6/will_a_new_interface_help/,9,2
11rljxa,Need help choosing equpiment for live music (Progressive metal),Total-Pickle-7033,1678853082.0,https://www.reddit.com/r/WeAreTheMusicMakers/comments/11rljxa/need_help_choosing_equpiment_for_live_music/,14,2
11tu1g0,Please Help.,speb1,1679066270.0,https://www.reddit.com/r/WeAreTheMusicMakers/comments/11tu1g0/please_help/,17,0
124jghb,AKAI MINI PLUS with ableton live need help,Any_Astronomer7666,1679996706.0,https://www.reddit.com/r/WeAreTheMusicMakers/comments/124jghb/akai_mini_plus_with_ableton_live_need_help/,2,10
11prycj,Need Help With Stereo Panning Mono tracks,Brinizle630,1678660086.0,https://www.reddit.com/r/WeAreTheMusicMakers/comments/11prycj/need_help_with_stereo_panning_mono_tracks/,17,1
12548cy,Help with keyboard to mixer buzz!,spicy_penguin,1680041668.0,https://www.reddit.com/r/WeAreTheMusicMakers/comments/12548cy/help_with_keyboard_to_mixer_buzz/,5,0
11p3icc,Need Insight and Help with Panning and Why I Might need,Brinizle630,1678590326.0,https://www.reddit.com/r/WeAreTheMusicMakers/comments/11p3icc/need_insight_and_help_with_panning_and_why_i/,13,1
125uog1,How would you spend 5k to grow your fanbase?,thro3829292020399,1680111102.0,https://www.reddit.com/r/WeAreTheMusicMakers/comments/125uog1/how_would_you_spend_5k_to_grow_your_fanbase/,186,179
11vz1dm,Looking for help finding a certain kind of audio spectrum analyzer VST.,FranticToaster,1679262845.0,https://www.reddit.com/r/WeAreTheMusicMakers/comments/11vz1dm/looking_for_help_finding_a_certain_kind_of_audio/,6,1
11poo4f,Need help distorting guitar while using looper pedal,tudoran,1678652371.0,https://www.reddit.com/r/WeAreTheMusicMakers/comments/11poo4f/need_help_distorting_guitar_while_using_looper/,7,2
12b99a6,How to ensure all videos are same volume,spookyhole5,1680583609.0,https://www.reddit.com/r/WeAreTheMusicMakers/comments/12b99a6/how_to_ensure_all_videos_are_same_volume/,23,41
123sqys,Should bands who have a live set worth of released music perform new material before it's released?,AsgardianWarrior96,1679935526.0,https://www.reddit.com/r/WeAreTheMusicMakers/comments/123sqys/should_bands_who_have_a_live_set_worth_of/,120,132
122r7vk,Help with warm/analog-sounding vocal production like Nick Hakim?,dudeoverderr,1679847392.0,https://www.reddit.com/r/WeAreTheMusicMakers/comments/122r7vk/help_with_warmanalogsounding_vocal_production/,1,0
128p0va,"I don't understand what a ""breakdown"" is in music structure.",I_am_Mind_Wanderer,1680361537.0,https://www.reddit.com/r/WeAreTheMusicMakers/comments/128p0va/i_dont_understand_what_a_breakdown_is_in_music/,56,44
128w3wq,How do you avoid squeaking sounds when fast-playing fifth chords in grindcore & death metal?,SR_RSMITH,1680377315.0,https://www.reddit.com/r/WeAreTheMusicMakers/comments/128w3wq/how_do_you_avoid_squeaking_sounds_when/,14,13
