post_id,title,author,created_utc,url,num_comments,score
ye2fbd,I wanted to share my personal “rules of the road” for the touring indie musician,Feather_Sound,1666802000.0,https://www.reddit.com/r/WeAreTheMusicMakers/comments/ye2fbd/i_wanted_to_share_my_personal_rules_of_the_road/,147,1000
xjq5io,I Compiled A List Of Rick Rubin Quotes For Music Makers,LuckyAlbright,1663721798.0,https://www.reddit.com/r/WeAreTheMusicMakers/comments/xjq5io/i_compiled_a_list_of_rick_rubin_quotes_for_music/,114,843
xywrhk,"I got 10,000 monthly listeners in under 3 months with no label, team, or money. Here’s what I learned.",EdinKaso,1665245941.0,https://www.reddit.com/r/WeAreTheMusicMakers/comments/xywrhk/i_got_10000_monthly_listeners_in_under_3_months/,160,696
u8xzaf,Enough already!,TheResinAnts,1650576229.0,https://www.reddit.com/r/WeAreTheMusicMakers/comments/u8xzaf/enough_already/,178,609
v6dtta,"I've created a website that extracts audio stems from songs using Spleeter, Demucs3, and Open Unmix for free.",spleeterio,1654549985.0,https://www.reddit.com/r/WeAreTheMusicMakers/comments/v6dtta/ive_created_a_website_that_extracts_audio_stems/,109,569
u9gvfc,"Approaching $100k in revenue and over 1 million streams across 6 years. How I ""made it"" as an unconventional electronic bedroom producer.",RrentTreznor,1650640148.0,https://www.reddit.com/r/WeAreTheMusicMakers/comments/u9gvfc/approaching_100k_in_revenue_and_over_1_million/,116,475
u1klvu,My Band Received a Record Deal through Submithub: A Cautionary Tale,jorund_brightbrewer,1649719156.0,https://www.reddit.com/r/WeAreTheMusicMakers/comments/u1klvu/my_band_received_a_record_deal_through_submithub/,79,368
z64bxz,Make sure you save different mix versions of your songs as you mix,dayoffmusician,1669563810.0,https://www.reddit.com/r/WeAreTheMusicMakers/comments/z64bxz/make_sure_you_save_different_mix_versions_of_your/,46,363
11dqk4o,"Truth and myths about mastering levels, listening, LUFS and general misconceptions - a guide to understand how loudness works",tmxband,1677540985.0,https://www.reddit.com/r/WeAreTheMusicMakers/comments/11dqk4o/truth_and_myths_about_mastering_levels_listening/,76,347
ubjj58,There are NO rules,LogicNewbie3,1650888179.0,https://www.reddit.com/r/WeAreTheMusicMakers/comments/ubjj58/there_are_no_rules/,92,350
109g8a1,"My bulletproof technique for finding appropriate levels for instruments in the mix. I call it ""Blind Man's Wisdom"", in short... BMW (yes I just made that up)",ArtiOfficial,1673471778.0,https://www.reddit.com/r/WeAreTheMusicMakers/comments/109g8a1/my_bulletproof_technique_for_finding_appropriate/,88,346
unurpc,"I just had that “embarrassing gig” that basically all live musicians have to go through, and as much as it hurt, it was a learning moment. Just wanted to share the experience.",Jimberson,1652337315.0,https://www.reddit.com/r/WeAreTheMusicMakers/comments/unurpc/i_just_had_that_embarrassing_gig_that_basically/,88,335
zttay2,What should i learn to be a good ear for my bf who is a music producer?,gotmesogood,1671831366.0,https://www.reddit.com/r/WeAreTheMusicMakers/comments/zttay2/what_should_i_learn_to_be_a_good_ear_for_my_bf/,205,335
w8hjxs,Any way to help my son develop his skills?,Nathaniel66,1658835649.0,https://www.reddit.com/r/WeAreTheMusicMakers/comments/w8hjxs/any_way_to_help_my_son_develop_his_skills/,173,313
10ewfpb,My little sister passed and I want to memorialize her.,AstronomerFinal7712,1674011764.0,https://www.reddit.com/r/WeAreTheMusicMakers/comments/10ewfpb/my_little_sister_passed_and_i_want_to_memorialize/,34,313
11p2638,Composition > Mixing,glenvilder,1678586595.0,https://www.reddit.com/r/WeAreTheMusicMakers/comments/11p2638/composition_mixing/,55,299
117fkrm,From overwhelmed to productive: my number one hack to beat procrastination (hope it helps!),kathalimus,1676915612.0,https://www.reddit.com/r/WeAreTheMusicMakers/comments/117fkrm/from_overwhelmed_to_productive_my_number_one_hack/,33,292
xscm12,"I started a new artist project and crossed 1k plays in 2 months. All organic and zero promotion. If you'll allow me, I think my experience could benefit someone. So here it is.",nomohmaya,1664571964.0,https://www.reddit.com/r/WeAreTheMusicMakers/comments/xscm12/i_started_a_new_artist_project_and_crossed_1k/,64,279
wvr305,What was the one thing that really improved your music making?,EdinKaso,1661266880.0,https://www.reddit.com/r/WeAreTheMusicMakers/comments/wvr305/what_was_the_one_thing_that_really_improved_your/,263,276
z2rwan,"How to Use ""Passing Chords"" in Your Music",LizzyLizJordan,1669217034.0,https://www.reddit.com/r/WeAreTheMusicMakers/comments/z2rwan/how_to_use_passing_chords_in_your_music/,27,267
ud9j6s,Another Artist Seems To Have Had My Music Removed,AlertImpress6347,1651082008.0,https://www.reddit.com/r/WeAreTheMusicMakers/comments/ud9j6s/another_artist_seems_to_have_had_my_music_removed/,87,266
v58edl,Can i learn piano with only one hand?,joyleader,1654414441.0,https://www.reddit.com/r/WeAreTheMusicMakers/comments/v58edl/can_i_learn_piano_with_only_one_hand/,201,247
