post_id,title,author,created_utc,url,num_comments,score
10jbjao,feels like my friends aren't taking me or the music seriously,MiMiLock,1674477581.0,https://www.reddit.com/r/makinghiphop/comments/10jbjao/feels_like_my_friends_arent_taking_me_or_the/,79,62
yd9fkb,"[Hip Hop Review Stream - Week 4] Reviewing your tracks on YouTube, Spotify, SoundCloud, Bandcamp, etc.",ImmortalBeingMusic,1666716228.0,https://www.reddit.com/r/makinghiphop/comments/yd9fkb/hip_hop_review_stream_week_4_reviewing_your/,446,59
y7a8zf,"[Hip Hop Review Stream - Week 3] Reviewing your tracks on YouTube, Spotify, SoundCloud, Bandcamp, etc.",ImmortalBeingMusic,1666107110.0,https://www.reddit.com/r/makinghiphop/comments/y7a8zf/hip_hop_review_stream_week_3_reviewing_your/,356,49
u5bp0z,Sexism,plantahna,1650157064.0,https://www.reddit.com/r/makinghiphop/comments/u5bp0z/sexism/,105,47
z6e2u9,Best free music distributor?,SlimG89,1669586582.0,https://www.reddit.com/r/makinghiphop/comments/z6e2u9/best_free_music_distributor/,33,45
x4ohx8,Music collaboration,Wonderful-One-5873,1662190228.0,https://www.reddit.com/r/makinghiphop/comments/x4ohx8/music_collaboration/,8,34
ucubi0,How many of you keep rotating between DAWs because you can’t 100% decide?,Mr_Voltiac,1651030438.0,https://www.reddit.com/r/makinghiphop/comments/ucubi0/how_many_of_you_keep_rotating_between_daws/,71,32
10qcurj,Struggling to find ways to promote music. Lmk how you do it,wattterrrr,1675204850.0,https://www.reddit.com/r/makinghiphop/comments/10qcurj/struggling_to_find_ways_to_promote_music_lmk_how/,46,28
uihvnq,"Looking for likeminded producers/engineers/artists to join a community production Discord to share/collab on loops, beats & get feedback! More info below...",CharZar321,1651702003.0,https://www.reddit.com/r/makinghiphop/comments/uihvnq/looking_for_likeminded_producersengineersartists/,198,25
yzqlk0,Any Australian rappers or producers from Brisbane?,Peteybe,1668904350.0,https://www.reddit.com/r/makinghiphop/comments/yzqlk0/any_australian_rappers_or_producers_from_brisbane/,39,25
uqsjyv,Trying to find rappers to collaborate with (beatmaker here),Wise-Wave4340,1652696067.0,https://www.reddit.com/r/makinghiphop/comments/uqsjyv/trying_to_find_rappers_to_collaborate_with/,31,27
u8j0qa,FREE *SAMPLE PACK* Look Inside Volume 02,Gen9820,1650530933.0,https://www.reddit.com/r/makinghiphop/comments/u8j0qa/free_sample_pack_look_inside_volume_02/,1,21
uvcp2a,[OFFICIAL] WHERE U AT???,AutoModerator,1653231611.0,https://www.reddit.com/r/makinghiphop/comments/uvcp2a/official_where_u_at/,69,18
whukks,My Debut Album: Skint - Humble,Skint_Music,1659809610.0,https://www.reddit.com/r/makinghiphop/comments/whukks/my_debut_album_skint_humble/,1,15
vi78qd,[OFFICIAL] WHERE U AT???,AutoModerator,1655910031.0,https://www.reddit.com/r/makinghiphop/comments/vi78qd/official_where_u_at/,63,13
v10non,I got selected from the r/makinghiphop live feedback event. With you guys help I have submitted my song “Paint a Mirror” to Murda Beatz through PROTÉGÉ. Wish me luck I’ll keep you guys in the loop!,The_Vice_Owl,1653918661.0,https://www.reddit.com/r/makinghiphop/comments/v10non/i_got_selected_from_the_rmakinghiphop_live/,3,12
10mepd7,In Search of Rappers for a Collaborative Album,kevboi2007,1674802875.0,https://www.reddit.com/r/makinghiphop/comments/10mepd7/in_search_of_rappers_for_a_collaborative_album/,36,11
uubswd,who can kill this beat (Ukraine Beatmaker),Smithwess94,1653093543.0,https://www.reddit.com/r/makinghiphop/comments/uubswd/who_can_kill_this_beat_ukraine_beatmaker/,17,12
yzizbi,Just wanted to share some reflections after releasing a new EP with a coworker!,Gradaluski,1668883618.0,https://www.reddit.com/r/makinghiphop/comments/yzizbi/just_wanted_to_share_some_reflections_after/,5,8
wuvxe0,[OFFICIAL] WHERE U AT???,AutoModerator,1661180411.0,https://www.reddit.com/r/makinghiphop/comments/wuvxe0/official_where_u_at/,57,6
ydea5y,General tips for (new) rappers,herboyblu,1666728272.0,https://www.reddit.com/r/makinghiphop/comments/ydea5y/general_tips_for_new_rappers/,1,8
yfs63c,[EP] JusLegacy & Soup - IN ARMS REACH,juslegacy,1666972733.0,https://www.reddit.com/r/makinghiphop/comments/yfs63c/ep_juslegacy_soup_in_arms_reach/,8,7
