post_id,title,author,created_utc,url,num_comments,score
12auptm,Remixes,fluffedahiphopbunny,1680549645.0,https://www.reddit.com/r/makinghiphop/comments/12auptm/remixes/,22,23
129sdst,Your friend that gave you feedback on that one song? This is what they actually meant.,Frank_Von_Tittyfuck,1680457540.0,https://www.reddit.com/r/makinghiphop/comments/129sdst/your_friend_that_gave_you_feedback_on_that_one/,70,128
121z1ap,"Finding local shows as a very small artist, what worked for me",Something_Funny_,1679778100.0,https://www.reddit.com/r/makinghiphop/comments/121z1ap/finding_local_shows_as_a_very_small_artist_what/,14,62
11ylnj0,[OFFICIAL] WHERE U AT???,AutoModerator,1679497212.0,https://www.reddit.com/r/makinghiphop/comments/11ylnj0/official_where_u_at/,42,3
11oldkx,Mastering panic,mjs5000,1678544478.0,https://www.reddit.com/r/makinghiphop/comments/11oldkx/mastering_panic/,31,27
11mwe75,Anyone ever test release their beat on Spotify to compare how it sounds to other beats on the platform?,dancetoken,1678378848.0,https://www.reddit.com/r/makinghiphop/comments/11mwe75/anyone_ever_test_release_their_beat_on_spotify_to/,12,5
11l0ywj,Networking opportunity for independent artists,kurstmusic,1678199723.0,https://www.reddit.com/r/makinghiphop/comments/11l0ywj/networking_opportunity_for_independent_artists/,75,34
11iuzc7,Looking to collab,UncleMarkCLE,1678015909.0,https://www.reddit.com/r/makinghiphop/comments/11iuzc7/looking_to_collab/,21,3
1193ct3,[OFFICIAL] WHERE U AT???,AutoModerator,1677081615.0,https://www.reddit.com/r/makinghiphop/comments/1193ct3/official_where_u_at/,36,4
117narh,Promoting shows? Any advice?,nocasino412,1676933777.0,https://www.reddit.com/r/makinghiphop/comments/117narh/promoting_shows_any_advice/,1,1
117kzxo,Type beat video artwork and likeness rights,acenoise,1676928280.0,https://www.reddit.com/r/makinghiphop/comments/117kzxo/type_beat_video_artwork_and_likeness_rights/,2,1
1140v0w,[Rant] Live Performance,Buddymaster39449,1676580983.0,https://www.reddit.com/r/makinghiphop/comments/1140v0w/rant_live_performance/,10,8
10qcurj,Struggling to find ways to promote music. Lmk how you do it,wattterrrr,1675204850.0,https://www.reddit.com/r/makinghiphop/comments/10qcurj/struggling_to_find_ways_to_promote_music_lmk_how/,46,27
10nthak,I like making beats and trying to do my think vocally. Anyone here fw my kind of music?,All_Stoned,1674950259.0,https://www.reddit.com/r/makinghiphop/comments/10nthak/i_like_making_beats_and_trying_to_do_my_think/,12,3
10imvlt,[OFFICIAL] WHERE U AT???,AutoModerator,1674403209.0,https://www.reddit.com/r/makinghiphop/comments/10imvlt/official_where_u_at/,7,1
108sdti,New Music Website Launching,RunHipHop,1673402688.0,https://www.reddit.com/r/makinghiphop/comments/108sdti/new_music_website_launching/,18,12
107ogwy,Is releasing a song every other month enough?,djffufsigiis,1673294888.0,https://www.reddit.com/r/makinghiphop/comments/107ogwy/is_releasing_a_song_every_other_month_enough/,12,0
104nhhq,Need help of a rapper,Mulamb0,1672988359.0,https://www.reddit.com/r/makinghiphop/comments/104nhhq/need_help_of_a_rapper/,8,1
104nbb1,Tips/advice on these videos?,Itzsaykridd,1672987733.0,https://www.reddit.com/r/makinghiphop/comments/104nbb1/tipsadvice_on_these_videos/,4,1
103389x,Would love to work on a whole project with someone or a group.,itssmitty77,1672837480.0,https://www.reddit.com/r/makinghiphop/comments/103389x/would_love_to_work_on_a_whole_project_with/,18,6
102h2tw,"Alot of posts about no support/how to promote etc, I have an idea 🤷🏼‍♂️",Itzsaykridd,1672774388.0,https://www.reddit.com/r/makinghiphop/comments/102h2tw/alot_of_posts_about_no_supporthow_to_promote_etc/,27,20
zywyvr,Probably a basic question but I'm new to this all: what is the best way to go about promoting music irl/online and where are the best places to post new songs?,milkycrops,1672394865.0,https://www.reddit.com/r/makinghiphop/comments/zywyvr/probably_a_basic_question_but_im_new_to_this_all/,26,2
